{
  "spec_version": "1.0",
  "metadata": {
    "name": "combined_repo_plan",
    "description": "Unified, idempotent repo modification plan merged from multiple specs",
    "target_repo": "DICKY1987/cli_multi_rapid_DEV",
    "generated_at": "2025-09-20T11:35:55Z",
    "deliverables_summary": [
      {
        "update_id": "2025-09-20T19:00_demo",
        "version": "1.0.0",
        "deliverables": [
          {
            "id": "doc.plan_updates",
            "must_contain": [
              "Plan Updates Workflow"
            ],
            "must_exist": true,
            "path": "docs/plan-updates.md",
            "type": "file",
            "title": "Plan Updates Guide",
            "expected_sha256": "b022425acce70bdc6c4b00c7ddc3bc8828e22d4963d1eb31868eee3bcb7ea003"
          }
        ]
      }
    ]
  },
  "defaults": {
    "if_exists": "skip",
    "encoding": "utf-8"
  },
  "execution": {
    "phases": [
      "validate",
      "apply"
    ],
    "dry_run": true
  },
  "ops": [
    {
      "op": "assert_contains",
      "file": "$PROMPT_FILE",
      "must_contain": [
        "\"$schema\": \"http://json-schema.org/draft-07/schema#\"",
        "<prefill>",
        "\"dup_threshold\": 0.92"
      ],
      "phase": "validate"
    },
    {
      "op": "locate",
      "id": "PROMPT_FILE",
      "glob": "**/*.xml",
      "must_contain": [
        "<prompt_blueprint",
        "id=\"Enterprise-Orchestrator-ErrorHungry\""
      ],
      "phase": "validate"
    },
    {
      "op": "replace_section",
      "file": "$PROMPT_FILE",
      "start_regex": "\\s*<!--\\s*13\\)\\s*Output\\s*formats[\\s\\S]*?<output_formats>",
      "end_regex": "</output_formats>",
      "replacement_base64": "ICA8IS0tIDEzKSBPdXRwdXQgZm9ybWF0cyAoc3RyaWN0IEpTT04gc2NoZW1hcyArIHJlc3BvbnNlIHByZWZpbGwpIC0tPgogIDxvdXRwdXRfZm9ybWF0cz4KICAgIDxzY2hlbWEgbmFtZT0ib3JjaGVzdHJhdG9yX3JlcG9ydCI+CiAgICAgIHsKICAgICAgICAiJHNjaGVtYSI6ICJodHRwOi8vanNvbi1zY2hlbWEub3JnL2RyYWZ0LTA3L3NjaGVtYSMiLAogICAgICAgICIkaWQiOiAiaHR0cHM6Ly9leGFtcGxlLmNvbS9vcmNoZXN0cmF0b3JfcmVwb3J0LnNjaGVtYS5qc29uIiwKICAgICAgICAidHlwZSI6ICJvYmplY3QiLAogICAgICAgICJhZGRpdGlvbmFsUHJvcGVydGllcyI6IGZhbHNlLAogICAgICAgICJwcm9wZXJ0aWVzIjogewogICAgICAgICAgImV4ZWN1dGl2ZV9zdW1tYXJ5IjogewogICAgICAgICAgICAidHlwZSI6ICJvYmplY3QiLAogICAgICAgICAgICAiYWRkaXRpb25hbFByb3BlcnRpZXMiOiBmYWxzZSwKICAgICAgICAgICAgInByb3BlcnRpZXMiOiB7CiAgICAgICAgICAgICAgImNyaXRpY2FsX2Vycm9yX2NvdW50IjogeyAidHlwZSI6ICJpbnRlZ2VyIiwgIm1pbmltdW0iOiAwIH0sCiAgICAgICAgICAgICAgImV2aWRlbmNlX3F1YWxpdHlfc2NvcmUiOiB7ICJ0eXBlIjogIm51bWJlciIsICJtaW5pbXVtIjogMCwgIm1heGltdW0iOiAxIH0sCiAgICAgICAgICAgICAgImZhbHNlX3Bvc2l0aXZlX3Jpc2siOiB7ICJ0eXBlIjogInN0cmluZyIsICJlbnVtIjogWyAiTk9ORSIsICJMT1ciLCAiTUVESVVNIiwgIkhJR0giIF0gfSwKICAgICAgICAgICAgICAiY2VydGlmaWNhdGlvbiI6IHsgInR5cGUiOiAic3RyaW5nIiB9LAogICAgICAgICAgICAgICJzY29yZWNhcmQiOiB7CiAgICAgICAgICAgICAgICAidHlwZSI6ICJvYmplY3QiLAogICAgICAgICAgICAgICAgImFkZGl0aW9uYWxQcm9wZXJ0aWVzIjogZmFsc2UsCiAgICAgICAgICAgICAgICAicHJvcGVydGllcyI6IHsKICAgICAgICAgICAgICAgICAgInF1YWxpdHlfc2NvcmUiOiB7ICJ0eXBlIjogIm51bWJlciIsICJtaW5pbXVtIjogMCwgIm1heGltdW0iOiAxMDAgfSwKICAgICAgICAgICAgICAgICAgImdhdGVzIjogewogICAgICAgICAgICAgICAgICAgICJ0eXBlIjogIm9iamVjdCIsCiAgICAgICAgICAgICAgICAgICAgImFkZGl0aW9uYWxQcm9wZXJ0aWVzIjogZmFsc2UsCiAgICAgICAgICAgICAgICAgICAgInByb3BlcnRpZXMiOiB7CiAgICAgICAgICAgICAgICAgICAgICAiZ2F0ZV9hX2NvdmVyYWdlIjogeyAidHlwZSI6ICJib29sZWFuIiB9LAogICAgICAgICAgICAgICAgICAgICAgImdhdGVfYl9kZXB0aCI6IHsgInR5cGUiOiAiYm9vbGVhbiIgfSwKICAgICAgICAgICAgICAgICAgICAgICJnYXRlX2NfZXZpZGVuY2UiOiB7ICJ0eXBlIjogImJvb2xlYW4iIH0KICAgICAgICAgICAgICAgICAgICB9LAogICAgICAgICAgICAgICAgICAgICJyZXF1aXJlZCI6IFsgImdhdGVfYV9jb3ZlcmFnZSIsICJnYXRlX2JfZGVwdGgiLCAiZ2F0ZV9jX2V2aWRlbmNlIiBdCiAgICAgICAgICAgICAgICAgIH0KICAgICAgICAgICAgICAgIH0sCiAgICAgICAgICAgICAgICAicmVxdWlyZWQiOiBbICJxdWFsaXR5X3Njb3JlIiwgImdhdGVzIiBdCiAgICAgICAgICAgICAgfQogICAgICAgICAgICB9LAogICAgICAgICAgICAicmVxdWlyZWQiOiBbICJjcml0aWNhbF9lcnJvcl9jb3VudCIsImV2aWRlbmNlX3F1YWxpdHlfc2NvcmUiLCJmYWxzZV9wb3NpdGl2ZV9yaXNrIiwiY2VydGlmaWNhdGlvbiIsInNjb3JlY2FyZCIgXQogICAgICAgICAgfSwKICAgICAgICAgICJmaW5kaW5ncyI6IHsKICAgICAgICAgICAgInR5cGUiOiAiYXJyYXkiLAogICAgICAgICAgICAiaXRlbXMiOiB7CiAgICAgICAgICAgICAgInR5cGUiOiAib2JqZWN0IiwKICAgICAgICAgICAgICAiYWRkaXRpb25hbFByb3BlcnRpZXMiOiBmYWxzZSwKICAgICAgICAgICAgICAicHJvcGVydGllcyI6IHsKICAgICAgICAgICAgICAgICJpZCI6IHsgInR5cGUiOiAic3RyaW5nIiB9LAogICAgICAgICAgICAgICAgInNldmVyaXR5IjogeyAidHlwZSI6ICJzdHJpbmciLCAiZW51bSI6IFsgIkZBVEFMIiwiQ1JJVElDQUwiLCJISUdIIiwiTUVESVVNIiwiTE9XIiBdIH0sCiAgICAgICAgICAgICAgICAiZXZpZGVuY2UiOiB7CiAgICAgICAgICAgICAgICAgICJ0eXBlIjogImFycmF5IiwKICAgICAgICAgICAgICAgICAgIm1pbkl0ZW1zIjogMSwKICAgICAgICAgICAgICAgICAgIml0ZW1zIjogeyAidHlwZSI6ICJzdHJpbmciIH0KICAgICAgICAgICAgICAgIH0sCiAgICAgICAgICAgICAgICAidmFsaWRhdGlvbl9wcm90b2NvbHMiOiB7CiAgICAgICAgICAgICAgICAgICJ0eXBlIjogImFycmF5IiwKICAgICAgICAgICAgICAgICAgIm1pbkl0ZW1zIjogMSwKICAgICAgICAgICAgICAgICAgIml0ZW1zIjogeyAidHlwZSI6ICJzdHJpbmciIH0KICAgICAgICAgICAgICAgIH0sCiAgICAgICAgICAgICAgICAidGhyZXNob2xkcyI6IHsgInR5cGUiOiAib2JqZWN0IiB9LAogICAgICAgICAgICAgICAgImV4Y2x1c2lvbl9jcml0ZXJpYSI6IHsKICAgICAgICAgICAgICAgICAgInR5cGUiOiAiYXJyYXkiLAogICAgICAgICAgICAgICAgICAiaXRlbXMiOiB7ICJ0eXBlIjogInN0cmluZyIgfSB9LAogICAgICAgICAgICAgICAgImFydGlmYWN0cyI6IHsKICAgICAgICAgICAgICAgICAgInR5cGUiOiAiYXJyYXkiLAogICAgICAgICAgICAgICAgICAiaXRlbXMiOiB7CiAgICAgICAgICAgICAgICAgICAgInR5cGUiOiAib2JqZWN0IiwKICAgICAgICAgICAgICAgICAgICAiYWRkaXRpb25hbFByb3BlcnRpZXMiOiBmYWxzZSwKICAgICAgICAgICAgICAgICAgICAicHJvcGVydGllcyI6IHsKICAgICAgICAgICAgICAgICAgICAgICJraW5kIjogeyAidHlwZSI6ICJzdHJpbmciLCAiZW51bSI6IFsgImxvZyIsInN0YWNrdHJhY2UiLCJsaW5lcyIsInBlcmYiLCJzY3JlZW5zaG90IiwicGNhcCIgXSB9LAogICAgICAgICAgICAgICAgICAgICAgInJlZiI6IHsgInR5cGUiOiAic3RyaW5nIiB9CiAgICAgICAgICAgICAgICAgICAgfSwKICAgICAgICAgICAgICAgICAgICAicmVxdWlyZWQiOiBbICJraW5kIiwgInJlZiIgXQogICAgICAgICAgICAgICAgICB9CiAgICAgICAgICAgICAgICB9LAogICAgICAgICAgICAgICAgInJlcXVpcmVkIjogWyAiaWQiLCJzZXZlcml0eSIsImV2aWRlbmNlIiwidmFsaWRhdGlvbl9wcm90b2NvbHMiIF0sCiAgICAgICAgICAgICAgICAiYWxsT2YiOiBbCiAgICAgICAgICAgICAgICAgIHsKICAgICAgICAgICAgICAgICAgICAiaWYiOiB7ICJwcm9wZXJ0aWVzIjogeyAic2V2ZXJpdHkiOiB7ICJjb25zdCI6ICJGQVRBTCIgfSB9IH0sCiAgICAgICAgICAgICAgICAgICAgInRoZW4iOiB7ICJwcm9wZXJ0aWVzIjogeyAiZXZpZGVuY2UiOiB7ICJtaW5JdGVtcyI6IDMgfSB9IH0KICAgICAgICAgICAgICAgICAgfSwKICAgICAgICAgICAgICAgICAgewogICAgICAgICAgICAgICAgICAgICJpZiI6IHsgInByb3BlcnRpZXMiOiB7ICJzZXZlcml0eSI6IHsgImNvbnN0IjogIkNSSVRJQ0FMIiB9IH0gfSwKICAgICAgICAgICAgICAgICAgICAidGhlbiI6IHsgInByb3BlcnRpZXMiOiB7ICJldmlkZW5jZSI6IHsgIm1pbkl0ZW1zIjogMiB9IH0gfQogICAgICAgICAgICAgICAgICB9CiAgICAgICAgICAgICAgICBdCiAgICAgICAgICAgIH0KICAgICAgICAgIH0sCiAgICAgICAgICAidGVjaF9ndWlkZXMiOiB7CiAgICAgICAgICAgICJ0eXBlIjogIm9iamVjdCIsCiAgICAgICAgICAgICJhZGRpdGlvbmFsUHJvcGVydGllcyI6IGZhbHNlLAogICAgICAgICAgICAicHJvcGVydGllcyI6IHsKICAgICAgICAgICAgICAicG93ZXJzaGVsbCI6IHsKICAgICAgICAgICAgICAgICJ0eXBlIjogIm9iamVjdCIsCiAgICAgICAgICAgICAgICAicHJvcGVydGllcyI6IHsKICAgICAgICAgICAgICAgICAgImV2aWRlbmNlX3JlcXVpcmVkIjogewogICAgICAgICAgICAgICAgICAgICJ0eXBlIjogImFycmF5IiwKICAgICAgICAgICAgICAgICAgICAiaXRlbXMiOiB7ICJ0eXBlIjogInN0cmluZyIsICJlbnVtIjogWyAiY21kbGV0X2Vycm9yX2NvZGVzIiwiZXZlbnRfbG9nIiwicGVyZl9jb3VudGVycyIsInRyYW5zY3JpcHQiIF0gfSB9CiAgICAgICAgICAgICAgICB9CiAgICAgICAgICAgICAgfSwKICAgICAgICAgICAgICAiY3BwX2RsbCI6IHsgInR5cGUiOiAib2JqZWN0IiB9LAogICAgICAgICAgICAgICJweXRob24iOiB7ICJ0eXBlIjogIm9iamVjdCIgfSwKICAgICAgICAgICAgICAibXQ0X21xbDQiOiB7ICJ0eXBlIjogIm9iamVjdCIgfQogICAgICAgICAgICB9LAogICAgICAgICAgICAicmVxdWlyZWQiOiBbICJwb3dlcnNoZWxsIiwiY3BwX2RsbCIsInB5dGhvbiIsIm10NF9tcWw0IiBdCiAgICAgICAgICB9LAogICAgICAgICAgImRlcGVuZGVuY3lfbWF0cml4IjogeyAidHlwZSI6ICJvYmplY3QiIH0sCiAgICAgICAgICAib2JzZXJ2YWJpbGl0eSI6IHsgInR5cGUiOiAib2JqZWN0IiwgImFkZGl0aW9uYWxQcm9wZXJ0aWVzIjogdHJ1ZSB9LAogICAgICAgICAgImVtYmVkZGluZ3NfY2hlY2tzIjogewogICAgICAgICAgICAidHlwZSI6ICJvYmplY3QiLAogICAgICAgICAgICAiYWRkaXRpb25hbFByb3BlcnRpZXMiOiBmYWxzZSwKICAgICAgICAgICAgInByb3BlcnRpZXMiOiB7CiAgICAgICAgICAgICAgIm1vZGVsIjogeyAidHlwZSI6ICJzdHJpbmciIH0sCiAgICAgICAgICAgICAgInNpbWlsYXJpdHlfbWV0cmljIjogeyAidHlwZSI6ICJzdHJpbmciLCAiZW51bSI6IFsgImNvc2luZSIgXSB9LAogICAgICAgICAgICAgICJkdXBfdGhyZXNob2xkIjogeyAidHlwZSI6ICJudW1iZXIiLCAibWluaW11bSI6IDAsICJtYXhpbXVtIjogMSB9CiAgICAgICAgICAgIH0sCiAgICAgICAgICAgICJyZXF1aXJlZCI6IFsgIm1vZGVsIiwgInNpbWlsYXJpdHlfbWV0cmljIiwgImR1cF90aHJlc2hvbGQiIF0KICAgICAgICAgIH0KICAgICAgICB9LAogICAgICAgICJyZXF1aXJlZCI6IFsiZXhlY3V0aXZlX3N1bW1hcnkiLCJmaW5kaW5ncyIsInRlY2hfZ3VpZGVzIiwiZGVwZW5kZW5jeV9tYXRyaXgiIF0KICAgICAgfQogICAgPC9zY2hlbWE+CgogICAgPCEtLSBQcmVmaWxsIHRvIGxvY2sgc2hhcGUgLS0+CiAgICA8cHJlZmlsbD4KICAgICAgewogICAgICAgICJleGVjdXRpdmVfc3VtbWFyeSI6IHsKICAgICAgICAgICJjcml0aWNhbF9lcnJvcl9jb3VudCI6IDAsCiAgICAgICAgICAiZXZpZGVuY2VfcXVhbGl0eV9zY29yZSI6IDAuMCwKICAgICAgICAgICJmYWxzZV9wb3NpdGl2ZV9yaXNrIjogIkxPVyIsCiAgICAgICAgICAiY2VydGlmaWNhdGlvbiI6ICJOT04tRklOQUwgRFJBRlQiLAogICAgICAgICAgInNjb3JlY2FyZCI6IHsKICAgICAgICAgICAgInF1YWxpdHlfc2NvcmUiOiAwLAogICAgICAgICAgICAiZ2F0ZXMiOiB7ICJnYXRlX2FfY292ZXJhZ2UiOiBmYWxzZSwgImdhdGVfYl9kZXB0aCI6IGZhbHNlLCAiZ2F0ZV9jX2V2aWRlbmNlIjogZmFsc2UgfQogICAgICAgICAgfQogICAgICAgIH0sCiAgICAgICAgImZpbmRpbmdzIjogW10sCiAgICAgICAgInRlY2hfZ3VpZGVzIjogeyAicG93ZXJzaGVsbCI6IHt9LCAiY3BwX2RsbCI6IHt9LCAicHl0aG9uIjoge30sICJtdDRfbXFsNCI6IHt9IH0sCiAgICAgICAgImRlcGVuZGVuY3lfbWF0cml4Ijoge30sCiAgICAgICAgIm9ic2VydmFiaWxpdHkiOiB7fSwKICAgICAgICAiZW1iZWRkaW5nc19jaGVja3MiOiB7ICJtb2RlbCI6ICJ0ZXh0LWVtYmVkZGluZy0zLWxhcmdlIiwgInNpbWlsYXJpdHlfbWV0cmljIjogImNvc2luZSIsICJkdXBfdGhyZXNob2xkIjogMC45MiB9CiAgICAgIH0KICAgIDwvcHJlZmlsbD4KICA8L291dHB1dF9mb3JtYXRzPg==",
      "phase": "apply",
      "dry_run_effect": "scan_only",
      "allow_multiple_matches": false,
      "on_duplicate": "skip"
    },
    {
      "op": "write_file",
      "path": ".ai/schemas/envelope.schema.json",